{
  "schemaVersion": 1,
  "eventId": "0199488e-7d9d-7390-89f5-d4ec9e4b056c",
  "eventType": "scan.observed",
  "correlationId": "0199488e-7d9d-7390-89f5-d4ec9e4b056c",
  "tenantId": "11111111-1111-4111-8111-111111111111",
  "plantId": "22222222-2222-4222-8222-222222222222",
  "stationId": "55555555-5555-4555-8555-555555555555",
  "deviceId": "66666666-6666-4666-8666-666666666666",
  "observedAtUtc": "2026-09-03T12:01:00.000Z",
  "gatewayAcceptedAtUtc": "2026-09-03T12:01:00.041Z",
  "identifier": {
    "technology": "rfid",
    "value": "SIMULATED-EPC-000001"
  }
}
