{
  "schemaVersion": 1,
  "eventId": "0199488e-2b44-7d5b-8c5b-f594e3a3191b",
  "eventType": "scan.observed",
  "correlationId": "0199488e-2b44-7d5b-8c5b-f594e3a3191b",
  "tenantId": "11111111-1111-4111-8111-111111111111",
  "plantId": "22222222-2222-4222-8222-222222222222",
  "stationId": "33333333-3333-4333-8333-333333333333",
  "deviceId": "44444444-4444-4444-8444-444444444444",
  "observedAtUtc": "2026-09-03T12:00:00.000Z",
  "gatewayAcceptedAtUtc": "2026-09-03T12:00:00.025Z",
  "identifier": {
    "technology": "barcode",
    "value": "SIMULATED-BARCODE-000001"
  }
}
